source,author,title,description,url,urlToImage,publishedAt,content,sentiment,risk_level,risk_factor
"{'id': 'business-insider', 'name': 'Business Insider'}",Jamie Davis Smith,I tried my regular Starbucks latte with 5 different kinds of milk. There's only one I won't be ordering again.,"Now that Starbucks doesn't charge extra for non-dairy milks, I tried my latte with 2%, soy, coconut, almond, and oat milk to find the best one.",https://www.businessinsider.com/trying-starbucks-latte-with-different-kinds-of-milk-clear-winner-2024-12,https://i.insider.com/6764725c1cee543535a8586d?width=1200&format=jpeg,2024-12-24T15:33:01Z,"I tried Starbucks lattes with different kinds of milk now that the chain doesn't charge extra.Jamie Davis Smith
<ul><li>I tried my regular Starbucks latte with 2%, soy, coconut, almond, and oat milk… [+4496 chars]",0.0,Medium Risk,None
"{'id': 'business-insider', 'name': 'Business Insider'}",Lisa VanderVeen,"My husband of 20 years unexpectedly asked for a divorce. Since then, I've traveled to 21 countries and my life is better than ever.","I never expected to be alone in my 50s, but traveling has made me feel empowered.",https://www.businessinsider.com/unexpected-divorce-single-woman-travel-50s-2024-12,https://i.insider.com/676ac4ade3e473ef263aeb47?width=1200&format=jpeg,2024-12-29T11:43:01Z,"In the six years since my divorce, I've traveled to 21 countries, including Belgium (pictured).Courtesy of Lisa VanderVeen.
<ul><li>After 20 years, my husband blindsided me and said he wanted a divo… [+3862 chars]",0.0,Medium Risk,None
"{'id': 'business-insider', 'name': 'Business Insider'}",Allison Tibaldi,I upgraded to a premium-economy seat on an 8-hour flight. It was so worth the extra $200.,"My Neos premium-economy upgrade got me perks like lounge access, a delicious in-flight meal, and a spacious seat for my eight-hour flight to Italy.",https://www.businessinsider.com/premium-economy-upgrade-neos-airlines-review-italy-flight-2025-1,https://i.insider.com/677c50432be30c194fc529fe?width=1200&format=jpeg,2025-01-07T14:42:04Z,"Neos is an Italian airline.Fabrizio Gandolfo/SOPA Images/LightRocket via Getty Images
<ul><li>I took an eight-hour flight with Italian airline Neos from New York to Palermo.</li><li>I booked a one-w… [+4091 chars]",0.04545454545454545,Medium Risk,None
"{'id': None, 'name': 'Cheezburger.com'}","Remy Millisky, Remy Millisky","Teenager weighs down entitled customer's car with 30 bags of concrete: '[They're] on your car, just like you asked'","When a dude in his 50s tried to tell a teenager what to do, the teen agreed… but the teenager still got the last laugh! 
You can try to tell a teenager what to do, but they're not necessarily going to listen to you. They might roll their eyes, scoff at you, …",https://cheezburger.com/38420229/teenager-weighs-down-entitled-customers-car-with-30-bags-of-concrete-theyre-on-your-car-just-like,https://i.chzbgr.com/original/38420229/hF646430A/teenagers-bosses-work-malicious-compliance-reddit-concrete-workplace-malicious-compliance-reddit,2024-12-27T16:00:00Z,"When a dude in his 50s tried to tell a teenager what to do, the teen agreed but the teenager still got the last laugh! 
You can try to tell a teenager what to do, but they're not necessarily going t… [+1206 chars]",0.09375,Medium Risk,None
