source,author,title,description,url,urlToImage,publishedAt,content,sentiment,risk_level,risk_factor
"{'id': None, 'name': 'Makezine.com'}",Dale Dougherty,I’m 3D Printing Chocolate,"Ellie Weinstein founded Cocoa Press, a company that manufactures printers that 3D print chocolate.
The post I’m 3D Printing Chocolate appeared first on Make: DIY Projects and Ideas for Makers.",https://makezine.com/article/digital-fabrication/3d-printing-workshop/im-3d-printing-chocolate/,https://i0.wp.com/makezine.com/wp-content/uploads/2024/12/Cocoa20press204.jpg?fit=1600%2C1066&ssl=1,2024-12-23T22:31:00Z,"A Conversation with Ellie Weinstein of Cocoa Press
Ellie Weinstein of Cocoa Press (photo credit: Penn Engineering)
In this episode of Make:Cast, I talk with Ellie Weinstein, founder and CEO of Coco… [+43192 chars]",0.0,Medium Risk,None
"{'id': 'business-insider', 'name': 'Business Insider'}",Sinéad Baker,Britain's most-loved chocolate brand was stripped of its royal seal of approval,"Cadbury, a storied chocolate maker owned by US company Mondelez, has lost its Royal Warrant from the British monarchy, which it's held since 1854.",https://www.businessinsider.com/cadbury-chocolate-loses-royal-warrants-seal-of-approval-mondelez-queen-2024-12,https://i.insider.com/67694dfce3e473ef263ab7a6?width=1200&format=jpeg,2024-12-23T14:20:07Z,"Cholocate brand Cadbury has lost its Royal Warrant, held since 1854.Sebastian Gollnow/picture alliance via Getty Images
<ul><li>Cholocate brand Cadbury has lost its royal warrant, which signified it… [+3133 chars]",0.0,Medium Risk,None
"{'id': 'business-insider', 'name': 'Business Insider'}",Anneta Konstantinides,A world-renowned chocolatier shares the 2 store-bought chocolate brands he buys for himself,"Christophe Rull, a chocolatier and the executive pastry chef at LA's iconic Hotel Bel-Air, swears by Läderach, a family-owned Swiss chocolate company.",https://www.businessinsider.com/best-store-bought-chocolate-brands-chocolatier-2024-12,https://i.insider.com/675c95c5cf8d1359a2dffc95?width=1200&format=jpeg,2024-12-21T11:52:02Z,"Chocolatier Christophe Rull shared his favorite store-bought chocolate brands.Gabi Musat/500px/Getty Images
<ul><li>Christophe Rull is a world-renowned chocolate master and executive pastry chef at … [+2308 chars]",0.5,Low Risk,None
"{'id': 'business-insider', 'name': 'Business Insider'}","Anneta Konstantinides,Rachel Askinasi",Ina Garten has the best holiday recipes. Here are the dishes we think should be part of your celebrations this year.,"Ina Garten's recipes are the best. We tested dozens to determine which to include in your holiday meal, whether you're dining solo or having a party.",https://www.businessinsider.com/ina-garten-best-holiday-recipes,https://i.insider.com/6769f14a9de00e389eb326de?width=1200&format=jpeg,2024-12-24T15:10:11Z,"We're revealing our favorite Ina Garten recipes for the holiday season.Peter Kramer/NBC/NBC Newswire/NBCUniversal via Getty Images
<ul><li>We love Ina Garten's recipes, especially during the holiday… [+10012 chars]",0.3333333333333333,Low Risk,None
"{'id': None, 'name': 'Cool Hunting'}",Evan Orensten,Organic Chocolate Covered Cashew Hunks,Hu Kitchen’s Chocolate Covered Cashew Hunks (and almonds) hit the perfect balance. Noticeably different from most chocolate covered treats they do not have the typical shiny confectioners glaze and instead go for …,http://coolhunting.com/buy/organic-chocolate-covered-cashews/,https://150102931.v2.pressablecdn.com/wp-content/uploads/2025/01/cashews-vanilla-bean-hunks-hunk-hu-320509_720x.jpeg,2025-01-15T04:21:41Z,"George CleverleyCrafted from ostrich leather, lined with with double-faced duchesse satin (100% silk) and hand-sewn in London, this luxurious eye mask hails from English heritage brand George Cleverl… [+1081 chars]",0.0,Medium Risk,None
"{'id': None, 'name': 'Seths.blog'}",Seth Godin,Collectibles (and list updates),The Strategy Deck that I made to go with my book has developed a real following. It’s a powerful way to break a creative logjam. Taking out the deck in a meeting lowers resistance and increases a sense of possibility and playfulness. I’ve just gone back to pr…,https://seths.blog/2025/01/collectibles-and-list-updates/,https://seths.blog/wp-content/uploads/2018/06/seth_godin_ogimages_v02_1806139-1.jpg,2025-01-02T17:22:00Z,The Strategy Deck that I made to go with my book has developed a real following. It’s a powerful way to break a creative logjam. Taking out the deck in a meeting lowers resistance and increases a sen… [+1590 chars],0.225,Low Risk,None
"{'id': 'business-insider', 'name': 'Business Insider'}",Paige Bennett,14 of the best specialty items to get at Aldi this month for $5 or less,"This January, Aldi is set to stock its shelves with frozen appetizers, seasonal Valentine's Day snacks, and easy meals, all for $5 or less.",https://www.businessinsider.com/best-cheap-things-to-get-at-aldi-january-2025,https://i.insider.com/677563bbe5726ab18d0e3cac?width=1200&format=jpeg,2025-01-01T16:23:00Z,"Aldi has a number of frozen meals and fun snacks coming in January. Aldi
<ul><li>This month, Aldi is stocking shelves with frozen appetizers, easy meals, and seasonal snacks. </li><li>Ahead of Valen… [+6060 chars]",0.3666666666666667,Low Risk,None
"{'id': None, 'name': 'Food52.com'}",Anna Arriaga,I Tried Giada’s Viral Chocolate Hazelnut Pasta—And I Didn't Hate It,"Former Food Network star Giada De Laurentiis is trying to start a ""chocolate pasta movement.” Recently, the Italian cook shared a childhood recipe on TikTok: warm pasta covered in hazelnut spread. Alarming? Buddy the Elf spaghetti level of craziness? Maybe, b…",https://food52.com/blog/28602-giada-chocolate-viral-pasta-honest-review-trending,https://images.food52.com/6um2s_PH-Jz9YGUkgRk2-00R-Uw=/fit-in/1200x1200/8a3ef7e0-8821-4573-b5e3-7c0fd352dddb--Untitled_design.png,2024-12-24T06:00:00Z,"Former Food Network star Giada De Laurentiis is trying to start a ""chocolate pasta movement. Recently, the Italian cook shared a childhood recipe on TikTok: warm pasta covered in hazelnut spread. Ala… [+1686 chars]",0.15,Low Risk,None
"{'id': 'business-insider', 'name': 'Business Insider'}",Gabbi Shaw,"I went to HomeGoods for some last-minute holiday gifts, and the selection was overwhelming",I went to HomeGoods on December 23 and found a lot of options for great holiday gifts.,https://www.businessinsider.com/homegoods-best-store-last-minute-holiday-gifts-2024-12,https://i.insider.com/676ae3a79de00e389eb34063?width=1200&format=jpeg,2024-12-24T18:28:28Z,"I almost knocked things off this table with how overflowing it was.Gabbi Shaw/Business Insider
<ul><li>HomeGoods is a favorite of both interior designers and consumers alike.</li><li>It's also a gre… [+4997 chars]",0.5,Low Risk,None
"{'id': 'buzzfeed', 'name': 'Buzzfeed'}",Jamie Davis Smith,"""There's Really No Upper Limit"": Doctors Share The Foods We Should Eat More Of (And How They Can Impact Our Lives)","If you love dark chocolate and kimchi, you're going to love this list...View Entire Post ›",https://www.buzzfeed.com/jamiedavissmith/best-foods-long-life-experts-sc,https://img.buzzfeed.com/buzzfeed-static/static/2025-01/8/21/campaign_images/808b090840e3/theres-really-no-upper-limit-doctors-share-the-fo-5-410-1736371608-7_dblbig.jpg,2025-01-13T12:16:02Z,"Anyone who wants to live a long and healthy life wants a magic formula for reaching a ripe old age. Unfortunately, it isnt that easy but there are some things you can do to bolster your odds.
If you… [+931 chars]",0.16885521885521887,Low Risk,None
"{'id': 'business-insider', 'name': 'Business Insider'}",Kim Schewitz,A nutrition scientist was hooked on snacks like chocolate and chips. She made 3 simple changes and now enjoys them without overeating.,Alex Ruani used to reach for sweet treats when she was bored or stressed. She transformed her relationship with snacking with by making small but impactful changes.,https://www.businessinsider.com/nutrition-scientist-stop-overeating-snacks-chocolate-chips-simple-change-2025-1,https://i.insider.com/678a3e472fcded5e90739dce?width=1200&format=jpeg,2025-01-18T07:26:01Z,"Alex Ruani
<ul><li>Alex Ruani used to overeat snacks that weren't nutritious.</li><li>A few changes transformed her relationship with snacking.</li><li>She started eating her meals at the same time … [+3874 chars]",-0.1,Medium Risk,None
"{'id': None, 'name': 'Thekitchn.com'}",Patty Catalano,I'd Give Up Every Christmas Gift for One Bite of this Chocolate Mousse,"Chocolate-lovers, rejoice!
READ MORE...",https://www.thekitchn.com/best-chocolate-mousse-recipe-23698525,"https://cdn.apartmenttherapy.info/image/upload/f_auto,q_auto:eco,c_fill,g_auto,w_1500,ar_3:2/k%2FPhoto%2FRecipes%2F2024-11-chocolate-mousse%2Fchocolate-mousse-497",2024-12-20T17:00:00Z,"For a chocolate dessert lover like me, nothing puts a bow on the end of a special meal quite like chocolate mousse. This classic dessert is more refined than chocolate pudding and what youd expect to… [+381 chars]",0.3412698412698412,Low Risk,None
"{'id': None, 'name': 'Xataka.com'}",Alejandro Alcolea,"En plena fiebre de la reinvención del turrón, me ha dado por hacer turrón casero. Y pienso repetir","Me encanta el turrón. No estoy solo en esto ni en la redacción ni en el país, pero lo que me gusta es el turrón clásico. Que se quiten las moderneces de sabores exóticos, los turrones de jamón, de piruleta o de patatas fritas. Lo que quiero es turrón de almen…",https://www.xataka.com/magnet/plena-fiebre-reinvencion-turron-me-ha-dado-hacer-turron-casero-pienso-repetir,https://i.blogs.es/6eb1d5/turron-3/840_560.jpeg,2024-12-22T17:01:35Z,"Me encanta el turrón. No estoy solo en esto ni en la redacción ni en el país, pero lo que me gusta es el turrón clásico. Que se quiten las moderneces de sabores exóticos, los turrones de jamón, de pi… [+5265 chars]",0.0,Medium Risk,None
"{'id': None, 'name': 'swissinfo.ch'}",Anand Chandrasekhar,The chocolate of the future will have less cocoa or none at all,The high price of cocoa beans along with laws against deforestation have sparked a hunt for new chocolate ingredients.,https://www.swissinfo.ch/eng/multinational-companies/the-chocolate-of-the-future-will-have-less-cocoa-or-none-at-all/78517426,"https://www.swissinfo.ch/content/wp-content/uploads/sites/13/2024/05/600611205_highres.jpg?fit=1200,800",2024-12-24T16:25:34Z,"Keystone 
The high price of cocoa beans along with consumer concerns and government regulations surrounding deforestation and child labour have sparked a hunt for new chocolate ingredients. 
This c… [+6233 chars]",0.1481818181818182,Low Risk,None
"{'id': 'ign', 'name': 'IGN'}",Wesley Yin-Poole,Hollow Knight: Silksong Dev Fuels Nintendo Switch 2 Direct Fever With a Picture of a Chocolate Cake,Here's why a picture of a chocolate cake has Hollow Knight: Silksong fans convinced they will finally see the game at the Nintendo Switch 2 Direct.,https://www.ign.com/articles/hollow-knight-silksong-dev-fuels-nintendo-switch-2-direct-fever-with-a-picture-of-a-chocolate-cake,https://assets-prd.ignimgs.com/2025/01/17/cake-again-1737107519421.png?width=1280,2025-01-17T09:52:11Z,"Its been six years since Team Cherry announced Hollow Knight: Silksong, the eagerly awaited sequel to 2017 Metroidvania masterpiece Hollow Knight. In those years fans have seen Silksong pop up and fa… [+3028 chars]",-0.1,Medium Risk,None
"{'id': 'business-insider', 'name': 'Business Insider'}",Katherine Tangalakis-Lippert,I had a holiday lunch at Disney's invite-only Club 33 and it made me see why someone would sue to keep their membership,"For Christmas, I was gifted a lunch at Disneyland's elite Club 33 and it ranked among the best meals of my life.",https://www.businessinsider.com/holiday-lunch-disneyland-club-thirty-three-2024-12,https://i.insider.com/676f67b19de00e389eb3b3cc?width=1200&format=jpeg,2025-01-01T14:16:02Z,"Disneyland's Club 33, named for its address on 33 Royal Street in New Orleans Square, features the numbers throughout its decor.Katherine Tangalakis-Lippert
<ul><li>For Christmas, I was gifted a lun… [+7263 chars]",0.3181818181818182,Low Risk,None
"{'id': None, 'name': 'Thekitchn.com'}",Ashia Aubourg,The Popular Candle Lamp Has a Feature That Everyone Is Just Finding Out About,"It’s ideal for melting chocolate or cheese.
READ MORE...",https://www.thekitchn.com/candle-warmer-fondue-hack-23705865,"https://cdn.apartmenttherapy.info/image/upload/f_auto,q_auto:eco,c_fill,g_auto,w_1500,ar_3:2/commerce%2Fluzdiosa-candle-warmer-lamp",2025-01-20T02:15:00Z,"We independently select these products—if you buy from one of our links, we may earn a commission. All prices were accurate at the time of publishing.
The most coveted item at my familys white eleph… [+1254 chars]",0.22500000000000003,Low Risk,None
"{'id': None, 'name': 'BBC News'}",,Valencians struggling to recover from devastating floods,"The Spanish region was badly hit by flooding in October, and the clean up is far from over.",https://www.bbc.com/news/articles/crk0z56g6zko,https://ichef.bbci.co.uk/news/1024/branded_news/4317/live/8bdc03b0-bd2b-11ef-9234-170be320bd9e.jpg,2024-12-22T00:12:37Z,"Pascual Andreu doesn't plan to reopen his chocolate business after the factory was damaged by flood water
Pascual Andreu points proudly to a black-and-white photograph stuck to the wall of the premi… [+6496 chars]",0.8,Low Risk,Flood
"{'id': None, 'name': 'Skinnytaste.com'}",Gina,Protein White Hot Chocolate,"This 3-ingredient Protein White Hot Chocolate recipe is too easy not to share. I make it all the time, it’s my go-to on cold nights! High-Protein White Hot Chocolate When I crave hot chocolate, it’s usually white hot chocolate. One night, I created this simpl…",https://www.skinnytaste.com/protein-white-hot-chocolate/,https://www.skinnytaste.com/wp-content/uploads/2024/12/Protein-White-Hot-Chocolate-11.jpg,2024-12-29T15:10:00Z,"This post may contain affiliate links. Read my disclosure policy.
This 3-ingredient Protein White Hot Chocolate recipe is too easy not to share. I make it all the time, it’s my go-to on cold nights!… [+3934 chars]",0.020833333333333343,Medium Risk,None
"{'id': None, 'name': 'Davidlebovitz.com'}",David,Salted Chocolate Chip Tahini Cookies,"Whenever I mention “Chocolate Chip Cookies,” this recipe seems to come up in the conversation. I’ve been making chocolate chip cookies all of my life, and am always happy to add new ones to my repertoire. I’ve made them with various kinds of flours, different…",https://www.davidlebovitz.com/salted-chocolate-chip-tahini-cookies-cookie-recipe/,https://www.davidlebovitz.com/wp-content/uploads/2017/05/Salted-Chocolate-Chip-Tahini-cookie-recipe-5.jpg,2025-01-06T14:48:26Z,"Whenever I mention “Chocolate Chip Cookies,” this recipe seems to come up in the conversation. I’ve been making chocolate chip cookies all of my life, and am always happy to add new ones to my repert… [+6563 chars]",0.4681818181818182,Low Risk,None
"{'id': None, 'name': 'BBC News'}",,I've seen Gavin & Stacey but I can't tell anyone what happens,Gavin & Stacey returns to our screens on Christmas Day for one final time - and I've seen it.,https://www.bbc.com/news/articles/ce32kw9d27xo,https://ichef.bbci.co.uk/news/1024/branded_news/32e3/live/b3586610-bf18-11ef-9326-13e7c15b7ab2.jpg,2024-12-25T08:32:22Z,"The gang are partying but what are they celebrating? You'll have to wait until Christmas night
It's been five years since the last Gavin &amp; Stacey Christmas special aired in 2019, and since then … [+3002 chars]",0.1523809523809524,Low Risk,None
"{'id': None, 'name': 'WQOW TV News 18'}","Sandee LaMotte, CNN","Lead and cadmium found in muscle-building protein powders, report says","(CNN) — Over-the-counter protein powders may contain disturbing levels of lead and cadmium, with the highest amounts found in plant-based, organic and chocolate-flavored products, according to a new investigation.",https://www.wqow.com/health-watch/lead-and-cadmium-found-in-muscle-building-protein-powders-report-says/article_882063dc-8b86-5437-ac52-49530da83de0.html,https://bloximages.newyork1.vip.townnews.com/wqow.com/content/tncms/assets/v3/editorial/e/02/e029babf-8862-5b93-83ed-3c818bd504bc/677fdc341d961.image.jpg?crop=1763%2C926%2C0%2C124&resize=1200%2C630&order=crop%2Cresize,2025-01-12T18:22:38Z,"(CNN) Over-the-counter protein powders may contain disturbing levels of lead and cadmium, with the highest amounts found in plant-based, organic and chocolate-flavored products, according to a new in… [+5836 chars]",-0.18181818181818182,High Risk,None
"{'id': None, 'name': 'Xataka.com'}",Carlos Prego,"El sector del turrón se las prometía felices explorando sabores, hasta que se topó con una crisis histórica en el precio del cacao","Ironías del mercado, una de las industrias que más ha innovado a lo largo de los últimos años en Navidad es también una de las más tradicionales: la del turrón. Quizás podamos discutir (o no) si todas sus nuevas creaciones pueden llamarse así, ‘turrón’; pero …",https://www.xataka.com/magnet/sector-turron-se-prometia-felices-explorando-sabores-que-se-topo-crisis-historica-precio-cacao,https://i.blogs.es/453ce7/tttrrr0/840_560.jpeg,2024-12-22T12:01:30Z,"Ironías del mercado, una de las industrias que más ha innovado a lo largo de los últimos años en Navidad es también una de las más tradicionales: la del turrón. Quizás podamos discutir (o no) si toda… [+6763 chars]",0.0,Medium Risk,None
"{'id': 'business-insider', 'name': 'Business Insider'}",Stephanie Dreyer,"I'm vegan, but the rest of my family isn't. So, I'm relying on these 8 tasty Trader Joe's finds this holiday season.","I'm the only one who eats vegan at my house, and I rely on Trader Joe's for holiday essentials when I'm planing for parties, dinners, and gatherings.",https://www.businessinsider.com/best-things-trader-joes-holidays-vegan-mom-mixed-diet-family-2024-12,https://i.insider.com/6761bcc31d90e3bcf31d66be?width=1200&format=jpeg,2024-12-21T11:48:02Z,"I've discovered some of Trader Joe's best vegan holiday staples.Stephanie Dreyer
<ul><li>I'm the only vegan in my family, and I stock up on holiday foods everyone can eat at Trader Joe's.</li><li>Bo… [+5046 chars]",0.5,Low Risk,None
"{'id': 'the-verge', 'name': 'The Verge'}",Charles Pulliam-Moore,10 excellent shows and movies from 2024 to stream on Max,Max has you covered if you’re looking for some solid films and TV shows to stream this holiday season.,https://www.theverge.com/24305797/max-best-shows-movies-streaming-2024-hbo,https://cdn.vox-cdn.com/thumbor/_WNI0dB3sOKre0M9MVC0tT58AaE=/0x0:2040x1360/1200x628/filters:focal(1020x680:1021x681)/cdn.vox-cdn.com/uploads/chorus_asset/file/25784213/247333_EOY_Package_Check_In_CVirginia_MAX_.jpg,2024-12-21T14:00:00Z,"Between The Penguin, Dune: Prophecy, and I Saw the TV Glow, Max has you covered when it comes to last-minute streaming options to get you through the holidays.
ByCharles Pulliam-Moore, a reporter fo… [+10537 chars]",0.0,Medium Risk,None
"{'id': None, 'name': 'Mental Floss'}",CaLea Johnson,Making Peppermint Bark at Home Is the Perfect Holiday Activity,Surprise your guests with this chocolate and peppermint treat.,https://www.mentalfloss.com/homemade-peppermint-bark-recipe,"https://images2.minutemediacdn.com/image/upload/c_crop,w_2000,h_1125,x_0,y_208/v1734711752/images/voltaxMediaLibrary/mmsport/mentalfloss/01jfje1cq08pj77de4fk.jpg",2024-12-23T14:01:00Z,"One of the best parts about the holidays is the desserts. This time of year brings festive favorites like gumdrops, sugar cookies, and chocolates. If youre craving a crowd-pleaser thats perfect for a… [+4784 chars]",1.0,Low Risk,None
"{'id': None, 'name': 'CNET'}",Katie Collins,Stop Scalding Your Tongue On Tea and Soup. This $25 Cat Robot 'Blows' on Your Drink to Cool It,Why blow on your hot food when you can get a robot to do it for you?,https://www.cnet.com/home/kitchen-and-household/stop-scalding-your-tongue-on-tea-and-soup-this-25-cat-robot-blows-on-your-drink-to-cool-it/,https://www.cnet.com/a/img/resize/4b49e7f8350ac2ae1df82789c4d39be926553deb/hub/2025/01/06/2ddf47aa-684b-4382-8600-54bbec13c625/cat-cooling-mug-robot-ces-2025.jpg?auto=webp&fit=crop&height=675&width=1200,2025-01-06T09:03:03Z,"Think of the noise that emerges from your lips when you blow on food that's too hot to eat. It probably sounds something a little like ""fufu."" It's from this onomatopoeic sound that the Nékojita cat … [+1869 chars]",0.15416666666666667,Low Risk,None
"{'id': None, 'name': 'AppleInsider'}",news@appleinsider.com (William Gallagher),"Tim Cook talks wine, chocolate, and how Apple Watch saved his father","Apple CEO Tim Cook has given a rare personal interview in which he recounts how Apple Watch fall detection saved his father's life, and recommends where to eat in San Francisco.While in London, Tim Cook (left) also had a pint with ""Slow Horses"" star Jack Lowd…",https://appleinsider.com/articles/25/01/15/tim-cook-talks-wine-chocolate-and-how-apple-watch-saved-his-father,https://photos5.appleinsider.com/gallery/62006-128411-000-lede-Tim-Cook-and-Slow-Horses-xl.jpg,2025-01-15T16:48:58Z,"Apple CEO Tim Cook has given a rare personal interview in which he recounts how Apple Watch fall detection saved his father's life, and recommends where to eat in San Francisco.
During his December … [+3063 chars]",0.15,Low Risk,None
"{'id': None, 'name': 'Food52.com'}",Julia Youman,Need a Break This Baking Season? These Fancy Boxed Mixes Are Here To Help,"If you’re the go-to dessert person—the one always tapped for cookie swaps, bake sales, or holiday party potlucks—December probably feels like one endless baking marathon. As the month winds down, so does your flour supply, your sugar stash, and your baking st…",https://food52.com/blog/28587-premium-boxed-dessert-mixes,https://images.food52.com/3Mk2YAp8SjpRZZWs4r_Ndwoa5Ik=/fit-in/1200x1200/921e888f-4718-47c0-9f75-7956ebec69c2--2022-0804_basic-great-chocolate-chip-cookies-from-tara-obrady_genius_3x2_julia-gartland_169.jpg,2024-12-23T06:00:00Z,"If youre the go-to dessert personthe one always tapped for cookie swaps, bake sales, or holiday party potlucksDecember probably feels like one endless baking marathon. As the month winds down, so doe… [+3381 chars]",-0.14027777777777778,High Risk,None
"{'id': None, 'name': 'Food52.com'}",Nea Arentzen,These Bakery-Worthy Marshmallow Fluff Cookies Might Convince You to Go Pro,"Over the past few months, as I’ve been thinking of Swedish recipes to develop, one specific cookie kept coming to mind: “mums-mums” or “grädbullar”, directly translated into my words as marshmallow fluff cookies or cream balls. Imagine a fluffy marshmallow fi…",https://food52.com/blog/28627-marshmallow-fluff-cookies,https://images.food52.com/-m1iWLblczUg6wpcTMDuJVN3eXY=/fit-in/1200x1200/d834bc02-7697-4957-9405-53428e440fb8--fluff_cookies.JPG,2025-01-13T20:31:25Z,"Over the past few months, as Ive been thinking of Swedish recipes to develop, one specific cookie kept coming to mind: mums-mums or grädbullar, directly translated into my words as marshmallow fluff … [+3225 chars]",-0.09,Medium Risk,None
"{'id': None, 'name': 'Yahoo Entertainment'}",,Scientists uncover unexpected ally that could help save the world's declining chocolate supply: 'Our results suggest a clear path forward',,https://consent.yahoo.com/v2/collectConsent?sessionId=1_cc-session_c8f0f4c0-66ad-49ac-9d92-5202fbc9354b,,2025-01-07T10:45:52Z,"If you click 'Accept all', we and our partners, including 238 who are part of the IAB Transparency &amp; Consent Framework, will also store and/or access information on a device (in other words, use … [+678 chars]",-0.125,High Risk,None
"{'id': None, 'name': 'Slickdeals.net'}",PennyFound,20-Count 1.5-Oz Kinder Bueno Milk Chocolate & Hazelnut Cream Chocolate Bars $11.75,"Amazon has *20-Count 1.5-Oz Kinder Bueno Milk Chocolate and Hazelnut Cream Chocolate Bars* on sale for *$11.75*. *Shipping is free* w/ Prime or on $35+ orders. 
 
Thanks to Deal Hunter *PennyFound*...",https://slickdeals.net/f/18054228-20-count-1-5-oz-kinder-bueno-milk-chocolate-hazelnut-cream-chocolate-bars-11-75-free-shipping-w-prime-or-on-35?utm_source=rss&utm_content=fp&utm_medium=RSS2,https://slickdeals.net/attachment/8/3/9/2/450x450/16935924.thumb,2025-01-13T20:41:46Z,"This collaborative space allows users to contribute additional information, tips, and insights to enhance the original deal post. Feel free to share your knowledge and help fellow shoppers make infor… [+26 chars]",0.3875,Low Risk,None
"{'id': None, 'name': 'Gizmodo.com'}",Ed Cara,"Your Protein Shake May Be Laced With Lead, Report Finds","Nearly half of tested products contained potentially unsafe levels of lead, cadmium, and other toxic metals, according to a new report from the Clean Labels Project.",https://gizmodo.com/your-protein-shake-may-be-laced-with-lead-report-finds-2000549496,https://gizmodo.com/app/uploads/2025/01/protein-powder.jpg,2025-01-13T20:55:41Z,Your post-workout protein shake may come with some hidden dangerous ingredients. A new report finds that a substantial proportion of over-the-counter protein powders contain potentially unsafe levels… [+3228 chars],-0.15757575757575756,High Risk,None
