source,author,title,description,url,urlToImage,publishedAt,content,sentiment,risk_level,risk_factor
"{'id': None, 'name': 'Cheezburger.com'}","Remy Millisky, Remy Millisky",25+ Secret Santa recipients who wish they hadn't swapped presents: 'Bought someone $25 worth of chocolate... received a cabbage',"They say gift-giving is an art, and these people are no artists. 
Imagine the excitement of waiting to give your loved one a gift you know they're going to adore. There's nothing like watching your favorite cousin's eyes light up as they unwrap a copy of tha…",https://cheezburger.com/38374149/25-secret-santa-recipients-who-wish-they-hadnt-swapped-presents-bought-someone-25-worth-of-chocolate,https://i.chzbgr.com/original/38374149/hB24C4E37/gifts-presents-school-funny-stories-work-coworkers-secret-santa-askreddit-gift-santa-funny-opinions,2024-12-23T16:00:00Z,"They say gift-giving is an art, and these people are no artists. 
Imagine the excitement of waiting to give your loved one a gift you know they're going to adore. There's nothing like watching your … [+1028 chars]",0.7,Low Risk,None
"{'id': None, 'name': 'Mental Floss'}",Rudie Obias,8 Unforgettable Pop-Tart Flavors That We Wish Weren’t Discontinued,"Even though these Pop-Tart flavors are discontinued now, we still can't help but wish they’d bring back Frosted Grape and a few of these other classic picks.",https://www.mentalfloss.com/discontinued-pop-tart-flavors,https://minutemedia-ressh.cloudinary.com/image/upload/v1736372659/shape/cover/sport/kellogg_s_pop_tarts_commercial__1993___so_cool_they_re_hot_-f5f016807ded9be7f2a0a29f7a83a839.jpg,2025-01-10T13:02:00Z,"Since its introduction in 1964, Kelloggs Pop-Tarts have delighted children and adults of all ages. These sweet, toaster-friendly pastries are beloved for a reasonespecially if you have no time to mak… [+5835 chars]",0.5833333333333333,Low Risk,None
"{'id': None, 'name': 'Slickdeals.net'}",cinnamonlovely,Select Locations: 8.5-Oz Lindt Lindor Snickerdoodle White Chocolate Candy Truffles $4.50,Remind a friend or loved one of how much they mean to you this holiday season with Lindt LINDOR Snickerdoodle White Chocolate Truffles. With festive holiday packaging these white chocolate candy truff,https://slickdeals.net/f/18023451-select-locations-8-5-oz-lindt-lindor-snickerdoodle-white-chocolate-candy-truffles-4-50?utm_source=rss&utm_content=fp&utm_medium=RSS2,https://slickdeals.net/attachment/4/2/8/1/6/200x200/16864161.thumb,2024-12-29T02:15:22Z,"This collaborative space allows users to contribute additional information, tips, and insights to enhance the original deal post. Feel free to share your knowledge and help fellow shoppers make infor… [+26 chars]",0.3875,Low Risk,None
"{'id': None, 'name': 'Slickdeals.net'}",cinnamonlovely,Select Accounts: 8.5-Oz Lindt Lindor Snickerdoodle White Chocolate Candy Truffles $4.50,Remind a friend or loved one of how much they mean to you this holiday season with Lindt LINDOR Snickerdoodle White Chocolate Truffles. With festive holiday packaging these white chocolate candy truff,https://slickdeals.net/f/18023451-lindt-lindor-holiday-snickerdoodle-white-chocolate-candy-truffles-with-smooth-melting-truffle-center-8-5-oz-bag-4-49?utm_source=rss&utm_content=fp&utm_medium=RSS2,https://slickdeals.net/attachment/4/2/8/1/6/200x200/16864161.thumb,2024-12-29T02:15:22Z,"This collaborative space allows users to contribute additional information, tips, and insights to enhance the original deal post. Feel free to share your knowledge and help fellow shoppers make infor… [+26 chars]",0.3875,Low Risk,None
"{'id': None, 'name': 'Slickdeals.net'}",LolaBunny21,30-Oz Harry & David Holiday Moose Munch Popcorn Drum $12.45 + Free Store Pickup,"Macy's [macys.com] has *30-Oz Harry & David Holiday Moose Munch Popcorn Drum *(Milk Chocolate/Classic Caramel/Dark Chocolate) on sale for *$12.43*. Select free store pickup where available, otherwise...",https://slickdeals.net/f/18042444-30-oz-harry-david-holiday-moose-munch-popcorn-drum-12-43-free-store-pickup-at-macy-s-or-free-shipping-on-25?utm_source=rss&utm_content=fp&utm_medium=RSS2,https://slickdeals.net/attachment/3/1/7/1/9/9/0/1/200x200/16906899.thumb,2025-01-07T23:12:06Z,"This collaborative space allows users to contribute additional information, tips, and insights to enhance the original deal post. Feel free to share your knowledge and help fellow shoppers make infor… [+26 chars]",0.3875,Low Risk,None
"{'id': None, 'name': 'Cheezburger.com'}","Lana DeGaetano, Lana DeGaetano","Woman cheaps out on White Elephant gift despite opting to participate in pricier gifting tier, is booted from social group when they suspect she did it to ‘trade up’","Gift exchanges are one of the most awkward events to be a part of. Especially with gifting ""games"" like White Elephant, you never know if the folks you're gifting and receiving gifts from have your best interest. Yeah, yeah. We know that Christmas time isn't …",https://cheezburger.com/38353157/woman-cheaps-out-on-white-elephant-gift-despite-opting-to-participate-in-pricier-gifting-tier-is,https://i.chzbgr.com/thumb1200/38353157/h32B97447/gifting-tier-is-booted-from-social-group-when-members-realize-she-probably-did-it-to-trade-up,2024-12-20T18:00:00Z,"Gift exchanges are one of the most awkward events to be a part of. Especially with gifting ""games"" like White Elephant, you never know if the folks you're gifting and receiving gifts from have your b… [+802 chars]",-0.024999999999999994,Medium Risk,None
"{'id': None, 'name': '[Removed]'}",,[Removed],[Removed],,,2024-12-27T19:34:02Z,[Removed],0.0,Medium Risk,None
"{'id': None, 'name': 'Jalopnik'}",Bradley Brownell,Lexus GX Owners Report Plastic Trim Melting Like Chocolate In The Sun,"We like the new Lexus GX around these parts, like, a lot. It is an all-around great truck with tons of luxury and off-roady engineering. It seems, however, that some of the engineering was perhaps half-assed. Some Lexus GX owners are reporting that their bran…",https://jalopnik.com/lexus-gx-owners-report-plastic-trim-melting-like-chocol-1851734059,"https://i.kinja-img.com/image/upload/c_fill,h_675,pg_1,q_80,w_1200/77f767a8911321fe61cfb9b454409711.png",2025-01-07T16:15:00Z,"We like the new Lexus GX around these parts, like, a lot. It is an all-around great truck with tons of luxury and off-roady engineering. It seems, however, that some of the engineering was perhaps ha… [+2414 chars]",0.37878787878787884,Low Risk,None
"{'id': 'business-insider', 'name': 'Business Insider'}",Jane Ridley,"As a Gen Xer raised in a frugal home, I skip my family's holiday present-giving. I find it too excessive.",The author hides upstairs when her kids open their gifts on Christmas Day because the present-giving makes her uncomfortable.,https://www.businessinsider.com/frugal-gen-x-cant-watch-kids-unwrap-gifts-excess-2024-12,https://i.insider.com/6763061d0a6d56a4f9c1de4a?width=1200&format=jpeg,2024-12-23T15:38:41Z,"The author finds it hard to see loads of presents under the Christmas tree.Serhii Sobolevskyi /Getty Images
<ul><li>I was raised in a frugal household where the number of Christmas gifts was limited… [+3017 chars]",-0.2916666666666667,High Risk,None
"{'id': 'business-insider', 'name': 'Business Insider'}",Amanda Perelli,How YouTube star MrBeast built a business that was tracking for $700 million in yearly revenue,"YouTube's top star, MrBeast, has over 338 million subscribers. He has a sprawling business, including products and an Amazon show.",https://www.businessinsider.com/mrbeast-youtube-business-brand-deals-amazon-show-income-revenue,https://i.insider.com/6764730a6c531c315b8965eb?width=1200&format=jpeg,2024-12-26T14:04:56Z,"MrBeast is YouTube's top creator.Jon Kopaloff/Getty Images for Prime Video
<ul><li>Jimmy Donaldson, who goes by MrBeast online, has become a household name.</li><li>Donaldson started his YouTube cha… [+3153 chars]",0.5,Low Risk,None
"{'id': None, 'name': 'HYPEBEAST'}",info@hypebeast.com (Hypebeast),"Travis Scott's ""Light Chocolate""-Flavored Nike Zoom Field Jaxx Leads This Week's Best Footwear Drops","Just like that, January is nearly halfway over. As New Year's resolutions begin to take hold (or not), brands are starting to ramp up their output once again. This week's list of notable footwear drops involves many Lunar New Year-themed pairs, with HOKA, Sal…",https://hypebeast.com/2025/1/best-sneaker-releases-january-2025-week-2-nike-hoka,https://image-cdn.hypb.st/https%3A%2F%2Fhypebeast.com%2Fimage%2F2025%2F01%2F13%2Fbest-sneaker-releases-january-2025-week-2-nike-hoka-tw.jpg?w=1080&cbr=1&q=90&fit=max,2025-01-14T18:21:29Z,"Just like that, January is nearly halfway over. As New Year’s resolutions begin to take hold (or not), brands are starting to ramp up their output once again. This week’s list of notable footwear dro… [+8331 chars]",0.18409090909090908,Low Risk,None
"{'id': None, 'name': 'Thekitchn.com'}",Ashia Aubourg,"Costco Is Selling a Famous NYC Dessert That's So Delicious, You'll Want 2","“Looks so good!!!” one shopper wrote. 
READ MORE...",https://www.thekitchn.com/costco-christmas-tree-cheesecake-23701653,"https://cdn.apartmenttherapy.info/image/upload/f_auto,q_auto:eco,c_fill,g_auto,w_1500,ar_3:2/stock%2Fshutterstock_2388440117",2024-12-25T14:15:00Z,"We independently select these products—if you buy from one of our links, we may earn a commission. All prices were accurate at the time of publishing.
When I first moved to NYC, I was in college, se… [+1613 chars]",0.2166666666666667,Low Risk,None
"{'id': None, 'name': 'Thekitchn.com'}",Ashia Aubourg,"If You Spot This $4.50 Luxury Dessert at Trader Joe’s, Grab 2","It makes a delicious gift.
READ MORE...",https://www.thekitchn.com/trader-joes-milk-chocolate-hazelnut-pralines-23702764,"https://cdn.apartmenttherapy.info/image/upload/f_auto,q_auto:eco,c_fill,g_auto,w_1500,ar_3:2/stock%2Fshutterstock_2508701957-tk-crop",2024-12-28T15:15:00Z,"A few accounts, including @traderjoesobsessed, known for posting the latest product releases at Trader Joes, shared about the launch of Crunchy Milk Chocolate Hazelnut Pralines, and shoppers flooded … [+389 chars]",0.15,Low Risk,Flood
"{'id': None, 'name': 'Directoalpaladar.com'}",Marina Blanco,Tarta de hojaldre con chocolate: un postre sencillo y súper vistoso,"Crujiente por fuera y suave por dentro, este dulce sencillo y elegante es ideal para cualquier ocasión especial, desde una merienda con amigos hasta una celebración festiva.
<!-- BREAK 1 -->
La tarta de hojaldre con chocolate es una receta fácil pero delicios…",https://www.directoalpaladar.com/postres/tarta-hojaldre-chocolate-postre-sencillo-super-vistoso,https://i.blogs.es/10b5b7/portada/840_560.jpg,2024-12-21T17:01:34Z,"Crujiente por fuera y suave por dentro, este dulce sencillo y elegante es ideal para cualquier ocasión especial, desde una merienda con amigos hasta una celebración festiva.
La tarta de hojaldre con… [+1507 chars]",0.9,Low Risk,None
"{'id': None, 'name': 'Uncrate.com'}",,Gnista Barreled Oak Non-Alcoholic Spirit,"Cocktails can continue past the holidays, even if you're trying to dry out. Non-alcoholic spirits like this one make it possible without sacrificing taste. Gnista began in Sweden ten years ago and has been a leader in the non-alcoholic space ever since. Gnist…",https://shop.uncrate.com/products/gnista-barreled-oak,http://shop.uncrate.com/cdn/shop/files/gnista-na1.jpg?v=1735573467,2024-12-30T17:00:01Z,"Cocktails can continue past the holidays, even if you're trying to dry out. Non-alcoholic spirits like this one make it possible without sacrificing taste. Gnista began in Sweden ten years ago and ha… [+282 chars]",-0.07916666666666666,Medium Risk,None
"{'id': None, 'name': 'Slickdeals.net'}",phoinix,38-Oz M&M's Peanut Milk Chocolate Candy $7.75,"Amazon [amazon.com] has *38-Oz M&M's Peanut Milk Chocolate Candy* for *$7.74*. *Shipping is free* with Prime or on $35+ orders. 
 
*Price:* 
*$5.22* lower (40% savings) than the *typical* price of...",https://slickdeals.net/f/18019386-7-74-38-oz-m-m-s-peanut-milk-chocolate-candy-at-amazon?utm_source=rss&utm_content=fp&utm_medium=RSS2,https://slickdeals.net/attachment/1/1/7/1/5/2/7/200x200/16855065.thumb,2024-12-26T14:07:09Z,"This collaborative space allows users to contribute additional information, tips, and insights to enhance the original deal post. Feel free to share your knowledge and help fellow shoppers make infor… [+26 chars]",0.3875,Low Risk,None
"{'id': None, 'name': 'Slickdeals.net'}",phoinix,39.37-Oz Reese's Miniatures Milk Chocolate Peanut Butter Cups $8.50,"Amazon has *39.37-Oz Reese's Miniatures Milk Chocolate Peanut Butter Cups* for *$8.49*. *Shipping is free* with Prime or on $35+ orders. 
 
Thanks to Deal Hunter *phoinix* for sharing this deal. 
...",https://slickdeals.net/f/18019389-8-49-39-37-oz-reese-s-miniatures-milk-chocolate-peanut-butter-cups-at-amazon?utm_source=rss&utm_content=fp&utm_medium=RSS2,https://slickdeals.net/attachment/1/1/7/1/5/2/7/200x200/16855077.thumb,2024-12-26T18:02:13Z,"This collaborative space allows users to contribute additional information, tips, and insights to enhance the original deal post. Feel free to share your knowledge and help fellow shoppers make infor… [+26 chars]",0.3875,Low Risk,None
"{'id': None, 'name': 'HYPEBEAST'}",info@hypebeast.com (Hypebeast),Travis Scott Announces His Latest Air Jordan 1 Low OG,"Name: Air Jordan 1 Low OG x Travis Scott ""Velvet Brown""Colorway: Velvet Brown / Dark MochaRelease Date: December 20Where to Buy: Cactus JackTravis Scott has officially lifted the curtain on his latest Air Jordan 1 Low OG. Dipped in a ""Velvet Brown/Dark Mocha""…",https://hypebeast.com/2024/12/travis-scott-air-jordan-1-aj1-low-og-sp-velvet-brown-dark-mocha-release-info-commercial-stream,https://image-cdn.hypb.st/https%3A%2F%2Fhypebeast.com%2Fimage%2F2024%2F12%2F20%2Ftravis-scott-air-jordan-1-aj1-low-og-sp-velvet-brown-dark-mocha-release-info-commercial-stream-tw.jpg?w=1080&cbr=1&q=90&fit=max,2024-12-21T01:16:08Z,"Name: Air Jordan 1 Low OG x Travis Scott “Velvet Brown”Colorway: Velvet Brown / Dark MochaRelease Date: December 20Where to Buy:Cactus Jack
Travis Scott has officially lifted the curtain on his late… [+1230 chars]",-0.075,Medium Risk,None
"{'id': None, 'name': 'HYPEBEAST'}",info@hypebeast.com (Hypebeast),OREO Unveils Six New Products for 2025,"OREO is set to kick off 2025 with a range of new products, including limited-edition cookies, returning fan favorites and new frozen treats. The brand will roll out six fresh offerings starting later this December.First up are the Oreo Game Day Cookies, arriv…",https://hypebeast.com/2024/12/oreo-six-new-products-2025-release-info,https://image-cdn.hypb.st/https%3A%2F%2Fhypebeast.com%2Fimage%2F2024%2F12%2F26%2Foreo-six-new-products-2025-release-info-tw.jpg?w=1080&cbr=1&q=90&fit=max,2024-12-26T09:46:39Z,"OREO is set to kick off 2025 with a range of new products, including limited-edition cookies, returning fan favorites and new frozen treats. The brand will roll out six fresh offerings starting later… [+965 chars]",0.1431818181818182,Low Risk,None
"{'id': None, 'name': 'Hipertextual'}",Azucena Martín,Soy nutricionista y esta es la cantidad de calorías que debes reducir cada día para perder peso,"¿Cuántas personas se han propuesto perder peso como propósito de año nuevo? ¿Quienes han empezado el 7 de enero obsesionados por dejar los kilos que han ganado a base de turrones, polvorones y roscón? Muchas personas habrán levantado la mano. Esta es época de…",http://hipertextual.com/2025/01/nutrocionista-calorias-perder-peso,https://imgs.hipertextual.com/wp-content/uploads/2025/01/total-shape-p7nwvfcjk-I-unsplash-scaled.jpg,2025-01-07T11:39:17Z,"¿Cuántas personas se han propuesto perder pesocomo propósito de año nuevo? ¿Quienes han empezado el 7 de enero obsesionados por dejar los kilos que han ganado a base de turrones, polvorones y roscón?… [+7031 chars]",-0.8,High Risk,None
"{'id': None, 'name': '/FILM'}",staff@slashfilm.com (Witney Seibold),What Happened To Willy Wonka & The Chocolate Factory's Charlie Actor Peter Ostrum?,Peter Ostrum played Charlie Bucket in Willy Wonka and the Chocolate Factory when he was 12 years old. Here's what he's gotten up to in the decades since then.,https://www.slashfilm.com/1743266/peter-ostrum-what-happened-charlie-actor-willy-wonka-and-the-chocolate-factory/,https://www.slashfilm.com/img/gallery/what-happened-to-willy-wonka-the-chocolate-factorys-charlie-actor-peter-ostrum/l-intro-1734640218.jpg,2024-12-25T01:00:30Z,"In a 2000 interview with NPR, Ostrum said that working on ""Willy Wonka"" was like being an exchange student, as he had to stick to his studies while living in Germany for about three months. He even g… [+1647 chars]",0.0,Medium Risk,None
"{'id': None, 'name': 'Directoalpaladar.com'}",Alicia González,"Este año repetimos turrón. Es de chocolate, pero con churros","Como buenos alicantinos en casa, somos muy exigentes con el turrón. Cada uno tiene sus preferencias, pero en general nos gustan todos los típicos. Así que cuando sale algún sabor nuevo o raro, nuestra reacción es cuanto menos hasta divertida. ¿Pero es que a q…",https://www.directoalpaladar.com/seleccion/este-ano-repetimos-turron-chocolate-churros,https://i.blogs.es/78d376/img_0945/840_560.jpeg,2024-12-21T08:31:30Z,"Como buenos alicantinos en casa, somos muy exigentes con el turrón. Cada uno tiene sus preferencias, pero en general nos gustan todos los típicos. Así que cuando sale algún sabor nuevo o raro, nuestr… [+4126 chars]",0.05000000000000002,Medium Risk,None
"{'id': None, 'name': 'Albuquerque Journal'}","Beth Trujillo , Albuquerque Journal, N.M.","Nature hikes, New Years and 'Willa Wonka': 7 events for this week","Dec. 26—You can get this New Year off with a splash by watching the disaster film classic ""The Poseidon Adventure"" at the Special Collections Library. Or...",https://www.abqjournal.com/lifestyle/article_97510000-b8cc-11ef-9e4b-c7f5a10ddf9c.html,https://s.yimg.com/cv/apiv2/social/images/yahoo_default_logo-1200x1200.png,2024-12-26T20:01:00Z,"Dec. 26You can get this New Year off with a splash by watching the disaster film classic ""The Poseidon Adventure"" at the Special Collections Library. Or check out one of these other options that migh… [+2005 chars]",0.13379329004329005,Low Risk,None
"{'id': None, 'name': 'Food52.com'}",Julia Youman,This Dessert is Trending—And Endlessly Tweakable,"Tiramisu is one of those desserts that never goes out of style, no matter the season or occasion. And right now—it’s reaching a peak. From tiramisu pancakes to the viral tiramisu brownies, it's clear the iconic flavors are having a major moment. And according…",https://food52.com/blog/28637-best-tiramisu-recipes,https://images.food52.com/UfXkZ9T0O9akUdQoZQ87VoIu-_0=/fit-in/1200x1200/bcabe5f0-dc78-4eeb-a7ce-a8a887a09ca4--2022-0914_pumpkin-tiramisu_seo_final_3x2_julia-garland_022.jpg,2025-01-18T07:00:00Z,"Tiramisu is one of those desserts that never goes out of style, no matter the season or occasion. And right nowits reaching a peak. From tiramisu pancakes to the viral tiramisu brownies, it's clear t… [+6283 chars]",0.19285714285714287,Low Risk,None
"{'id': None, 'name': 'HYPEBEAST'}",info@hypebeast.com (Hypebeast),Footpatrol x Saucony Collaboration Bring a Bold Spin to the ProGrid Omni 9,"Name: Footpatrol x Saucony ProGrid Omni 9Colorway: ""Blue/Chocolate-Black-Cream""SKU: TBCMSRP: TBCRelease Date: 2025Where to Buy: FootpatrolSaucony and European sneaker retailer Footpatrol have partnered to reimagine the ProGrid Omni 9 for an exclusive 2025 rel…",https://hypebeast.com/2024/12/footpatrol-saucony-progrid-omni-9-release-info,https://image-cdn.hypb.st/https%3A%2F%2Fhypebeast.com%2Fimage%2F2024%2F12%2F29%2Ffootpatrol-saucony-progrid-omni-9-release-info-tw.jpg?w=1080&cbr=1&q=90&fit=max,2024-12-30T03:07:17Z,"Name: Footpatrol x Saucony ProGrid Omni 9Colorway: “Blue/Chocolate-Black-Cream”SKU: TBCMSRP: TBCRelease Date: 2025Where to Buy:Footpatrol
Saucony and European sneaker retailer Footpatrol have partne… [+889 chars]",0.0,Medium Risk,None
"{'id': None, 'name': 'Directoalpaladar.com'}",Alicia González,Lidl tiene la forma más fácil de preparar el chocolate con el que acompañar el Roscón de Reyes,"En mi casa, la noche de reyes, el roscón se ha acompaña con chocolate. Da igual que sea roscón de Reyes de nata o trufa: el chocolate a la taza no puede faltar. Es una tradición que creo que se extiende a más hogares y, en el mío al menos, el estrés viene cua…",https://www.directoalpaladar.com/seleccion/lidl-tiene-forma-facil-preparar-chocolate-que-acompanar-roscon-reyes,https://i.blogs.es/143fef/by-ocu/840_560.jpeg,2025-01-03T08:31:39Z,"En mi casa, la noche de reyes, el roscón se ha acompaña con chocolate. Da igual que sea roscón de Reyes de nata o trufa: el chocolate a la taza no puede faltar. Es una tradición que creo que se extie… [+1939 chars]",0.0,Medium Risk,None
"{'id': None, 'name': 'Thekitchn.com'}",Ashia Aubourg,This Is Your Last Season to Get These Popular Girl Scout Cookie Flavors,"Get them while you can.
READ MORE...",https://www.thekitchn.com/girl-scout-smores-toastyay-discontinued-23704429,"https://cdn.apartmenttherapy.info/image/upload/f_auto,q_auto:eco,c_fill,g_auto,w_1500,ar_3:2/stock%2Fshutterstock_181102415",2025-01-08T23:15:00Z,"We independently select these products—if you buy from one of our links, we may earn a commission. All prices were accurate at the time of publishing.
Every year, folks eagerly anticipate running in… [+2240 chars]",0.20000000000000004,Low Risk,None
"{'id': None, 'name': 'Thekitchn.com'}",Alexandra Foster,"Ben & Jerry’s Just Launched Its Largest Tubs Ever, and Every Flavor Is So Good, I Can’t Pick a Favorite","“It’s about time!”
READ MORE...",https://www.thekitchn.com/ben-and-jerrys-scoop-apalooza-product-review-23705331,"https://cdn.apartmenttherapy.info/image/upload/f_auto,q_auto:eco,c_fill,g_auto,w_1500,ar_3:2/k%2FEdit%2F2025-01-ben-jerrys-new-flavors%2Fben-jerrys-new-flavors-5_6ad74f-crop",2025-01-14T16:30:00Z,"We independently select these products—if you buy from one of our links, we may earn a commission. All prices were accurate at the time of publishing.
Ben &amp; Jerrys pints have become a mainstay i… [+3548 chars]",0.20000000000000004,Low Risk,None
"{'id': None, 'name': 'Slickdeals.net'}",jk6812,39.52-Oz Hershey Kisses Milk Chocolate Christmas Candy Bulk Bag $8.50,Amazon [amazon.com] has *39.52-Oz Hershey Kisses Milk Chocolate Christmas Candy Bulk Bag *on sale for* $8.49*. Shipping is free w/ Prime or on $35+ orders.,https://slickdeals.net/f/18019236-39-52-oz-hershey-kisses-milk-chocolate-christmas-candy-bulk-bag-8-49-free-s-h-w-prime-or-on-35?utm_source=rss&utm_content=fp&utm_medium=RSS2,https://slickdeals.net/attachment/1/1/4/9/0/0/1/2/200x200/16854705.thumb,2024-12-26T15:18:53Z,"This collaborative space allows users to contribute additional information, tips, and insights to enhance the original deal post. Feel free to share your knowledge and help fellow shoppers make infor… [+26 chars]",0.3875,Low Risk,None
"{'id': None, 'name': 'The Atlantic'}",Stephanie Bai,Eight Perfect Episodes of TV,"Picks from Girls, The X-Files, SpongeBob, and more.",https://www.theatlantic.com/newsletters/archive/2025/01/eight-perfect-episodes-of-tv/681278/,https://cdn.theatlantic.com/thumbor/b1O2HteJ-ameNaF57xarFh2-Gog=/0x0:2000x1042/1200x625/media/img/mt/2025/01/HR_TCDGIRL_EC248/original.jpg,2025-01-12T12:00:00Z,"This is an edition of The Atlantic Daily, a newsletter that guides you through the biggest stories of the day, helps you discover new ideas, and recommends the best in culture. Sign up for it here.We… [+11523 chars]",0.37878787878787873,Low Risk,None
"{'id': None, 'name': 'BBC News'}",,'My partner hid and secretly waved off my ship': LGBT veteran monument revealed,"LGBT veterans forced out of the military look to the future, 25 years on from the ban being repealed.",https://www.bbc.com/news/articles/c70e0gep19xo,https://ichef.bbci.co.uk/news/1024/branded_news/3169/live/80904e50-d01b-11ef-94cb-5f844ceb9e30.jpg,2025-01-12T00:04:30Z,"Lt Cdr Duncan Lustig-Prean was forced to leave the Royal Navy in 1994
Intrusive interrogations, the shame of dishonourable discharge, criminal convictions that impacted their lives for years.
This … [+9598 chars]",-0.35000000000000003,High Risk,None
"{'id': 'new-scientist', 'name': 'New Scientist'}",Madeleine Cuff,Food made without farming will go on sale in the US in 2025,"Several start-ups are preparing to launch new foods made without plants, animals or soil, claiming that their products have a lower environmental impact",https://www.newscientist.com/article/2461346-food-made-without-farming-will-go-on-sale-in-the-us-in-2025/,https://images.newscientist.com/wp-content/uploads/2024/12/18115055/SEI_212098260.jpg,2024-12-31T10:00:49Z,"Croissant dough made from Savor’s farm-free butter
Savor
Growing numbers of people will be able to sample new types of butter, chocolate and ice cream made without input from animals, plants or soi… [+348 chars]",0.3181818181818182,Low Risk,None
